"No.","Time","Source","Destination","Protocol","Length"
"1","0.000000000","206.116.15.236","192.168.2.20","TCP","60","62955 > 30951 [ACK] Seq=1 Ack=1 Win=65392 Len=0"
"2","0.000069000","192.168.2.20","206.116.15.236","TCP","1314","30951 > 62955 [ACK] Seq=5041 Ack=1 Win=65520 Len=1260"
"3","0.000077000","192.168.2.20","206.116.15.236","TCP","1314","30951 > 62955 [ACK] Seq=6301 Ack=1 Win=65520 Len=1260"
"4","0.000081000","192.168.2.20","206.116.15.236","TCP","1314","30951 > 62955 [ACK] Seq=7561 Ack=1 Win=65520 Len=1260"
"5","0.000083000","192.168.2.20","206.116.15.236","TCP","1314","30951 > 62955 [ACK] Seq=8821 Ack=1 Win=65520 Len=1260"
"6","0.002259000","206.116.15.236","192.168.2.20","TCP","60","62955 > 30951 [ACK] Seq=1 Ack=2521 Win=65392 Len=0"
"7","0.002281000","192.168.2.20","206.116.15.236","TCP","1314","30951 > 62955 [ACK] Seq=10081 Ack=1 Win=65520 Len=1260"
"8","0.002286000","192.168.2.20","206.116.15.236","TCP","1314","30951 > 62955 [ACK] Seq=11341 Ack=1 Win=65520 Len=1260"
"9","0.002291000","192.168.2.20","206.116.15.236","TCP","1314","30951 > 62955 [ACK] Seq=12601 Ack=1 Win=65520 Len=1260"
"10","0.012573000","206.116.15.236","192.168.2.20","TCP","60","62955 > 30951 [ACK] Seq=1 Ack=5041 Win=65392 Len=0"
"11","0.012600000","192.168.2.20","206.116.15.236","TCP","1314","30951 > 62955 [ACK] Seq=13861 Ack=1 Win=65520 Len=1260"
"12","0.012605000","192.168.2.20","206.116.15.236","TCP","1314","30951 > 62955 [ACK] Seq=15121 Ack=1 Win=65520 Len=1260"
"13","0.155877000","192.168.2.20","54.175.168.57","TLSv1.2","187","Application Data"
"14","0.162133000","206.116.15.236","192.168.2.20","TCP","60","62955 > 30951 [ACK] Seq=1 Ack=7561 Win=65392 Len=0"
"15","0.162156000","192.168.2.20","206.116.15.236","TCP","1314","30951 > 62955 [ACK] Seq=16381 Ack=1 Win=65520 Len=1260"
"16","0.162161000","192.168.2.20","206.116.15.236","TCP","1314","30951 > 62955 [ACK] Seq=17641 Ack=1 Win=65520 Len=1260"
"17","0.167119000","206.116.15.236","192.168.2.20","TCP","60","62955 > 30951 [ACK] Seq=1 Ack=10081 Win=65392 Len=0"
"18","0.167139000","192.168.2.20","206.116.15.236","TCP","1314","30951 > 62955 [ACK] Seq=18901 Ack=1 Win=65520 Len=1260"
"19","0.167144000","192.168.2.20","206.116.15.236","TCP","1314","30951 > 62955 [ACK] Seq=20161 Ack=1 Win=65520 Len=1260"
"20","0.172600000","54.175.168.57","192.168.2.20","TLSv1.2","187","Application Data"
"21","0.182366000","206.116.15.236","192.168.2.20","TCP","60","62955 > 30951 [ACK] Seq=1 Ack=15121 Win=65392 Len=0"
"22","0.182394000","192.168.2.20","206.116.15.236","TCP","1314","30951 > 62955 [ACK] Seq=21421 Ack=1 Win=65520 Len=1260"
"23","0.182401000","192.168.2.20","206.116.15.236","TCP","1314","30951 > 62955 [ACK] Seq=22681 Ack=1 Win=65520 Len=1260"
"24","0.182406000","192.168.2.20","206.116.15.236","TCP","1314","30951 > 62955 [ACK] Seq=23941 Ack=1 Win=65520 Len=1260"
"25","0.182410000","192.168.2.20","206.116.15.236","TCP","1314","30951 > 62955 [ACK] Seq=25201 Ack=1 Win=65520 Len=1260"
"26","0.182413000","192.168.2.20","206.116.15.236","TCP","1314","30951 > 62955 [ACK] Seq=26461 Ack=1 Win=65520 Len=1260"
"27","0.202197000","192.168.2.20","224.0.0.251","MDNS","87","Standard query 0x0000  PTR _spotify-connect._tcp.local, ""QU"" question"
"28","0.202259000","192.168.2.20","224.0.0.251","MDNS","87","Standard query 0x0000  PTR _spotify-connect._tcp.local, ""QU"" question"
"29","0.224619000","192.168.2.20","54.175.168.57","TCP","54","2273 > 443 [ACK] Seq=134 Ack=134 Win=255 Len=0"
"30","0.242142000","206.116.15.236","192.168.2.20","TCP","79","62955 > 30951 [PSH, ACK] Seq=1 Ack=16381 Win=65392 Len=25"
"31","0.242185000","192.168.2.20","206.116.15.236","TCP","1314","30951 > 62955 [ACK] Seq=27721 Ack=26 Win=65495 Len=1260"
"32","0.269733000","66.61.80.155","192.168.2.20","UDP","70","Source port: 8719  Destination port: 30951"
"33","0.269822000","192.168.2.20","66.61.80.155","UDP","62","Source port: 30951  Destination port: 8719"
"34","0.302290000","206.116.15.236","192.168.2.20","TCP","60","62955 > 30951 [ACK] Seq=26 Ack=18901 Win=65392 Len=0"
"35","0.302330000","192.168.2.20","206.116.15.236","TCP","1314","30951 > 62955 [ACK] Seq=28981 Ack=26 Win=65495 Len=1260"
"36","0.302339000","192.168.2.20","206.116.15.236","TCP","1314","30951 > 62955 [ACK] Seq=30241 Ack=26 Win=65495 Len=1260"
"37","0.314725000","206.116.15.236","192.168.2.20","TCP","60","62955 > 30951 [ACK] Seq=26 Ack=21421 Win=65392 Len=0"
"38","0.314749000","192.168.2.20","206.116.15.236","TCP","1314","30951 > 62955 [ACK] Seq=31501 Ack=26 Win=65495 Len=1260"
"39","0.314755000","192.168.2.20","206.116.15.236","TCP","1314","30951 > 62955 [ACK] Seq=32761 Ack=26 Win=65495 Len=1260"
"40","0.334735000","206.116.15.236","192.168.2.20","TCP","60","62955 > 30951 [ACK] Seq=26 Ack=23941 Win=65392 Len=0"
"41","0.334760000","192.168.2.20","206.116.15.236","TCP","1314","30951 > 62955 [ACK] Seq=34021 Ack=26 Win=65495 Len=1260"
"42","0.334766000","192.168.2.20","206.116.15.236","TCP","1314","30951 > 62955 [ACK] Seq=35281 Ack=26 Win=65495 Len=1260"
"43","0.342131000","206.116.15.236","192.168.2.20","TCP","60","62955 > 30951 [ACK] Seq=26 Ack=26461 Win=65392 Len=0"
"44","0.342147000","192.168.2.20","206.116.15.236","TCP","1314","30951 > 62955 [ACK] Seq=36541 Ack=26 Win=65495 Len=1260"
"45","0.342150000","192.168.2.20","206.116.15.236","TCP","1314","30951 > 62955 [ACK] Seq=37801 Ack=26 Win=65495 Len=1260"
"46","0.342153000","192.168.2.20","206.116.15.236","TCP","1314","30951 > 62955 [ACK] Seq=39061 Ack=26 Win=65495 Len=1260"
"47","0.377012000","206.116.15.236","192.168.2.20","TCP","60","62955 > 30951 [ACK] Seq=26 Ack=28981 Win=65392 Len=0"
"48","0.377040000","192.168.2.20","206.116.15.236","TCP","1314","30951 > 62955 [ACK] Seq=40321 Ack=26 Win=65495 Len=1260"
"49","0.377046000","192.168.2.20","206.116.15.236","TCP","1314","30951 > 62955 [ACK] Seq=41581 Ack=26 Win=65495 Len=1260"
"50","0.447161000","206.116.15.236","192.168.2.20","TCP","125","62955 > 30951 [PSH, ACK] Seq=26 Ack=31501 Win=65392 Len=71"
"51","0.447213000","192.168.2.20","206.116.15.236","TCP","1314","30951 > 62955 [ACK] Seq=42841 Ack=97 Win=65424 Len=1260"
"52","0.447223000","192.168.2.20","206.116.15.236","TCP","1314","30951 > 62955 [ACK] Seq=44101 Ack=97 Win=65424 Len=1260"
"53","0.464301000","206.116.15.236","192.168.2.20","TCP","134","62955 > 30951 [PSH, ACK] Seq=97 Ack=34021 Win=65392 Len=80"
"54","0.464332000","192.168.2.20","206.116.15.236","TCP","1314","30951 > 62955 [ACK] Seq=45361 Ack=177 Win=65344 Len=1260"
"55","0.464338000","192.168.2.20","206.116.15.236","TCP","1314","30951 > 62955 [ACK] Seq=46621 Ack=177 Win=65344 Len=1260"
"56","0.475558000","192.168.2.20","76.114.119.164","UDP","118","Source port: 30951  Destination port: 15693"
"57","0.475660000","192.168.2.20","68.15.122.34","UDP","118","Source port: 30951  Destination port: 30079"
"58","0.488697000","192.168.2.20","52.0.104.40","DIS","66","PDUType: Unknown"
"59","0.492597000","206.116.15.236","192.168.2.20","TCP","71","62955 > 30951 [PSH, ACK] Seq=177 Ack=35281 Win=65392 Len=17"
"60","0.492638000","192.168.2.20","206.116.15.236","TCP","1314","30951 > 62955 [ACK] Seq=47881 Ack=194 Win=65327 Len=1260"
"61","0.504290000","52.0.104.40","192.168.2.20","DIS","62","PDUType: Unknown"
"62","0.504368000","192.168.2.20","66.61.80.155","UDP","62","Source port: 30951  Destination port: 8719"
"63","0.509735000","206.116.15.236","192.168.2.20","TCP","60","62955 > 30951 [ACK] Seq=194 Ack=37801 Win=65392 Len=0"
"64","0.509755000","192.168.2.20","206.116.15.236","TCP","1314","30951 > 62955 [ACK] Seq=49141 Ack=194 Win=65327 Len=1260"
"65","0.509760000","192.168.2.20","206.116.15.236","TCP","1314","30951 > 62955 [ACK] Seq=50401 Ack=194 Win=65327 Len=1260"
"66","0.552712000","67.162.114.2","192.168.2.20","UDP","118","Source port: 31543  Destination port: 30951"
"67","0.600032000","206.116.15.236","192.168.2.20","TCP","71","[TCP Previous segment not captured] 62955 > 30951 [PSH, ACK] Seq=211 Ack=44101 Win=65392 Len=17"
"68","0.600081000","192.168.2.20","206.116.15.236","TCP","66","[TCP Dup ACK 65#1] 30951 > 62955 [ACK] Seq=51661 Ack=194 Win=65327 Len=0 SLE=211 SRE=228"
"69","0.600114000","192.168.2.20","206.116.15.236","TCP","1314","30951 > 62955 [ACK] Seq=51661 Ack=194 Win=65327 Len=1260"
"70","0.600117000","192.168.2.20","206.116.15.236","TCP","1314","30951 > 62955 [ACK] Seq=52921 Ack=194 Win=65327 Len=1260"
"71","0.600122000","192.168.2.20","206.116.15.236","TCP","1314","30951 > 62955 [ACK] Seq=54181 Ack=194 Win=65327 Len=1260"
"72","0.600124000","192.168.2.20","206.116.15.236","TCP","1314","30951 > 62955 [ACK] Seq=55441 Ack=194 Win=65327 Len=1260"
"73","0.600126000","192.168.2.20","206.116.15.236","TCP","1314","30951 > 62955 [ACK] Seq=56701 Ack=194 Win=65327 Len=1260"
"74","0.600128000","192.168.2.20","206.116.15.236","TCP","1314","30951 > 62955 [ACK] Seq=57961 Ack=194 Win=65327 Len=1260"
"75","0.602619000","206.116.15.236","192.168.2.20","TCP","89","62955 > 30951 [PSH, ACK] Seq=228 Ack=45361 Win=65392 Len=35"
"76","0.602651000","192.168.2.20","206.116.15.236","TCP","66","[TCP Dup ACK 74#1] 30951 > 62955 [ACK] Seq=59221 Ack=194 Win=65327 Len=0 SLE=211 SRE=263"
"77","0.602669000","192.168.2.20","206.116.15.236","TCP","1314","30951 > 62955 [ACK] Seq=59221 Ack=194 Win=65327 Len=1260"
"78","0.632664000","206.116.15.236","192.168.2.20","TCP","60","62955 > 30951 [ACK] Seq=263 Ack=47881 Win=65392 Len=0"
"79","0.632709000","192.168.2.20","206.116.15.236","TCP","1314","30951 > 62955 [ACK] Seq=60481 Ack=194 Win=65327 Len=1260"
"80","0.632718000","192.168.2.20","206.116.15.236","TCP","1314","30951 > 62955 [ACK] Seq=61741 Ack=194 Win=65327 Len=1260"
"81","0.649753000","206.116.15.236","192.168.2.20","TCP","79","62955 > 30951 [PSH, ACK] Seq=263 Ack=51661 Win=65392 Len=25"
"82","0.649784000","192.168.2.20","206.116.15.236","TCP","66","[TCP Dup ACK 80#1] 30951 > 62955 [ACK] Seq=63001 Ack=194 Win=65327 Len=0 SLE=211 SRE=288"
"83","0.649806000","192.168.2.20","206.116.15.236","TCP","1314","30951 > 62955 [PSH, ACK] Seq=63001 Ack=194 Win=65327 Len=1260"
"84","0.649808000","192.168.2.20","206.116.15.236","TCP","1314","30951 > 62955 [ACK] Seq=64261 Ack=194 Win=65327 Len=1260"
"85","0.649812000","192.168.2.20","206.116.15.236","TCP","1314","30951 > 62955 [ACK] Seq=65521 Ack=194 Win=65327 Len=1260"
"86","0.654774000","69.80.184.22","192.168.2.20","UDP","70","Source port: 43486  Destination port: 30951"
"87","0.654874000","192.168.2.20","69.80.184.22","UDP","62","Source port: 30951  Destination port: 43486"
"88","0.716739000","Actionte_7e:95:df","Spanning-tree-(for-bridges)_00","STP","60","Conf. Root = 32768/0/00:7f:28:7e:95:e0  Cost = 0  Port = 0x8001"
"89","0.754754000","206.116.15.236","192.168.2.20","TCP","60","62955 > 30951 [ACK] Seq=288 Ack=54181 Win=65392 Len=0"
"90","0.754802000","192.168.2.20","206.116.15.236","TCP","1314","30951 > 62955 [ACK] Seq=66781 Ack=194 Win=65327 Len=1260"
"91","0.754810000","192.168.2.20","206.116.15.236","TCP","1314","30951 > 62955 [ACK] Seq=68041 Ack=194 Win=65327 Len=1260"
"92","0.760012000","206.116.15.236","192.168.2.20","TCP","60","62955 > 30951 [ACK] Seq=288 Ack=56701 Win=65392 Len=0"
"93","0.760033000","192.168.2.20","206.116.15.236","TCP","1314","30951 > 62955 [ACK] Seq=69301 Ack=194 Win=65327 Len=1260"
"94","0.760038000","192.168.2.20","206.116.15.236","TCP","1314","30951 > 62955 [ACK] Seq=70561 Ack=194 Win=65327 Len=1260"
"95","0.764295000","206.116.15.236","192.168.2.20","TCP","60","62955 > 30951 [ACK] Seq=288 Ack=59221 Win=65392 Len=0"
"96","0.764321000","192.168.2.20","206.116.15.236","TCP","1314","30951 > 62955 [ACK] Seq=71821 Ack=194 Win=65327 Len=1260"
"97","0.764327000","192.168.2.20","206.116.15.236","TCP","1314","30951 > 62955 [ACK] Seq=73081 Ack=194 Win=65327 Len=1260"
"98","0.764331000","192.168.2.20","206.116.15.236","TCP","1314","30951 > 62955 [ACK] Seq=74341 Ack=194 Win=65327 Len=1260"
"99","0.796888000","206.116.15.236","192.168.2.20","TCP","60","[TCP Previous segment not captured] 62955 > 30951 [ACK] Seq=305 Ack=63001 Win=65392 Len=0"
"100","0.796914000","192.168.2.20","206.116.15.236","TCP","1314","30951 > 62955 [ACK] Seq=75601 Ack=194 Win=65327 Len=1260"
"101","0.796920000","192.168.2.20","206.116.15.236","TCP","1314","30951 > 62955 [ACK] Seq=76861 Ack=194 Win=65327 Len=1260"
"102","0.796925000","192.168.2.20","206.116.15.236","TCP","1314","30951 > 62955 [ACK] Seq=78121 Ack=194 Win=65327 Len=1260"
"103","0.807279000","206.116.15.236","192.168.2.20","TCP","60","62955 > 30951 [ACK] Seq=305 Ack=65521 Win=65392 Len=0"
"104","0.807320000","192.168.2.20","206.116.15.236","TCP","1314","30951 > 62955 [ACK] Seq=79381 Ack=194 Win=65327 Len=1260"
"105","0.807326000","192.168.2.20","206.116.15.236","TCP","1314","30951 > 62955 [ACK] Seq=80641 Ack=194 Win=65327 Len=1260"
"106","0.894783000","206.116.15.236","192.168.2.20","TCP","60","62955 > 30951 [ACK] Seq=305 Ack=68041 Win=65392 Len=0"
"107","0.894826000","192.168.2.20","206.116.15.236","TCP","1314","30951 > 62955 [ACK] Seq=81901 Ack=194 Win=65327 Len=1260"
"108","0.894838000","192.168.2.20","206.116.15.236","TCP","1314","30951 > 62955 [ACK] Seq=83161 Ack=194 Win=65327 Len=1260"
"109","0.900023000","206.116.15.236","192.168.2.20","TCP","60","62955 > 30951 [ACK] Seq=305 Ack=70561 Win=65392 Len=0"
"110","0.900046000","192.168.2.20","206.116.15.236","TCP","1314","30951 > 62955 [ACK] Seq=84421 Ack=194 Win=65327 Len=1260"
"111","0.900052000","192.168.2.20","206.116.15.236","TCP","1314","30951 > 62955 [ACK] Seq=85681 Ack=194 Win=65327 Len=1260"
"112","0.902160000","206.116.15.236","192.168.2.20","TCP","60","62955 > 30951 [ACK] Seq=305 Ack=73081 Win=65392 Len=0"
"113","0.902180000","192.168.2.20","206.116.15.236","TCP","1314","30951 > 62955 [ACK] Seq=86941 Ack=194 Win=65327 Len=1260"
"114","0.902185000","192.168.2.20","206.116.15.236","TCP","1314","30951 > 62955 [ACK] Seq=88201 Ack=194 Win=65327 Len=1260"
"115","0.902214000","206.116.15.236","192.168.2.20","TCP","71","62955 > 30951 [PSH, ACK] Seq=305 Ack=75601 Win=65392 Len=17"
"116","0.902235000","192.168.2.20","206.116.15.236","TCP","74","[TCP Dup ACK 114#1] 30951 > 62955 [ACK] Seq=89461 Ack=194 Win=65327 Len=0 SLE=305 SRE=322 SLE=211 SRE=288"
"117","0.902245000","192.168.2.20","206.116.15.236","TCP","1314","30951 > 62955 [ACK] Seq=89461 Ack=194 Win=65327 Len=1260"
"118","0.902248000","192.168.2.20","206.116.15.236","TCP","1314","30951 > 62955 [ACK] Seq=90721 Ack=194 Win=65327 Len=1260"
"119","0.902251000","192.168.2.20","206.116.15.236","TCP","1314","30951 > 62955 [ACK] Seq=91981 Ack=194 Win=65327 Len=1260"
"120","0.962207000","206.116.15.236","192.168.2.20","TCP","60","62955 > 30951 [ACK] Seq=322 Ack=80641 Win=65392 Len=0"
"121","0.962241000","192.168.2.20","206.116.15.236","TCP","1314","30951 > 62955 [ACK] Seq=93241 Ack=194 Win=65327 Len=1260"
"122","0.962247000","192.168.2.20","206.116.15.236","TCP","1314","30951 > 62955 [ACK] Seq=94501 Ack=194 Win=65327 Len=1260"
"123","0.962252000","192.168.2.20","206.116.15.236","TCP","1314","30951 > 62955 [ACK] Seq=95761 Ack=194 Win=65327 Len=1260"
"124","0.962255000","192.168.2.20","206.116.15.236","TCP","1314","30951 > 62955 [ACK] Seq=97021 Ack=194 Win=65327 Len=1260"
"125","1.042266000","108.174.184.50","192.168.2.20","UDP","70","Source port: 45728  Destination port: 30951"
"126","1.042365000","192.168.2.20","69.80.184.22","UDP","62","Source port: 30951  Destination port: 43486"
"127","1.042389000","192.168.2.20","108.174.184.50","UDP","62","Source port: 30951  Destination port: 45728"
"128","1.047182000","72.45.131.18","192.168.2.20","UDP","70","Source port: 46189  Destination port: 30951"
"129","1.047260000","192.168.2.20","108.174.184.50","UDP","62","Source port: 30951  Destination port: 45728"
"130","1.047283000","192.168.2.20","72.45.131.18","UDP","62","Source port: 30951  Destination port: 46189"
"131","1.052801000","206.116.15.236","192.168.2.20","TCP","60","62955 > 30951 [ACK] Seq=322 Ack=83161 Win=65392 Len=0"
"132","1.052831000","192.168.2.20","206.116.15.236","TCP","1314","30951 > 62955 [ACK] Seq=98281 Ack=194 Win=65327 Len=1260"
"133","1.052838000","192.168.2.20","206.116.15.236","TCP","1314","30951 > 62955 [ACK] Seq=99541 Ack=194 Win=65327 Len=1260"
"134","1.056925000","206.116.15.236","192.168.2.20","TCP","60","[TCP Previous segment not captured] 62955 > 30951 [ACK] Seq=347 Ack=86941 Win=65392 Len=0"
"135","1.056947000","192.168.2.20","206.116.15.236","TCP","1314","30951 > 62955 [ACK] Seq=100801 Ack=194 Win=65327 Len=1260"
"136","1.056953000","192.168.2.20","206.116.15.236","TCP","1314","30951 > 62955 [ACK] Seq=102061 Ack=194 Win=65327 Len=1260"
"137","1.056957000","192.168.2.20","206.116.15.236","TCP","1314","30951 > 62955 [ACK] Seq=103321 Ack=194 Win=65327 Len=1260"
"138","1.060179000","206.116.15.236","192.168.2.20","TCP","60","62955 > 30951 [ACK] Seq=347 Ack=89461 Win=65392 Len=0"
"139","1.060203000","192.168.2.20","206.116.15.236","TCP","1314","30951 > 62955 [ACK] Seq=104581 Ack=194 Win=65327 Len=1260"
"140","1.060209000","192.168.2.20","206.116.15.236","TCP","1314","30951 > 62955 [ACK] Seq=105841 Ack=194 Win=65327 Len=1260"
"141","1.066664000","192.168.2.20","68.15.122.34","TCP","54","30951 > 57981 [RST, ACK] Seq=1 Ack=1 Win=0 Len=0"
"142","1.067166000","206.116.15.236","192.168.2.20","TCP","60","62955 > 30951 [ACK] Seq=347 Ack=91981 Win=65392 Len=0"
"143","1.067191000","192.168.2.20","206.116.15.236","TCP","1314","30951 > 62955 [ACK] Seq=107101 Ack=194 Win=65327 Len=1260"
"144","1.067196000","192.168.2.20","206.116.15.236","TCP","1314","30951 > 62955 [ACK] Seq=108361 Ack=194 Win=65327 Len=1260"
"145","1.104317000","206.116.15.236","192.168.2.20","TCP","60","62955 > 30951 [ACK] Seq=347 Ack=94501 Win=65392 Len=0"
"146","1.104344000","192.168.2.20","206.116.15.236","TCP","1314","30951 > 62955 [ACK] Seq=109621 Ack=194 Win=65327 Len=1260"
"147","1.104350000","192.168.2.20","206.116.15.236","TCP","1314","30951 > 62955 [ACK] Seq=110881 Ack=194 Win=65327 Len=1260"
"148","1.104355000","192.168.2.20","206.116.15.236","TCP","1314","30951 > 62955 [ACK] Seq=112141 Ack=194 Win=65327 Len=1260"
"149","1.107178000","206.116.15.236","192.168.2.20","TCP","60","62955 > 30951 [ACK] Seq=347 Ack=97021 Win=65392 Len=0"
"150","1.107211000","192.168.2.20","206.116.15.236","TCP","1314","30951 > 62955 [ACK] Seq=113401 Ack=194 Win=65327 Len=1260"
"151","1.107222000","192.168.2.20","206.116.15.236","TCP","1314","30951 > 62955 [ACK] Seq=114661 Ack=194 Win=65327 Len=1260"
"152","1.196967000","206.116.15.236","192.168.2.20","TCP","60","62955 > 30951 [ACK] Seq=347 Ack=103321 Win=65392 Len=0"
"153","1.197025000","192.168.2.20","206.116.15.236","TCP","1314","30951 > 62955 [ACK] Seq=115921 Ack=194 Win=65327 Len=1260"
"154","1.197030000","192.168.2.20","206.116.15.236","TCP","1314","30951 > 62955 [ACK] Seq=117181 Ack=194 Win=65327 Len=1260"
"155","1.197034000","192.168.2.20","206.116.15.236","TCP","1314","30951 > 62955 [ACK] Seq=118441 Ack=194 Win=65327 Len=1260"
"156","1.197036000","192.168.2.20","206.116.15.236","TCP","1314","30951 > 62955 [ACK] Seq=119701 Ack=194 Win=65327 Len=1260"
"157","1.197038000","192.168.2.20","206.116.15.236","TCP","1314","30951 > 62955 [ACK] Seq=120961 Ack=194 Win=65327 Len=1260"
"158","1.203170000","206.116.15.236","192.168.2.20","TCP","60","62955 > 30951 [ACK] Seq=347 Ack=105841 Win=65392 Len=0"
"159","1.203193000","192.168.2.20","206.116.15.236","TCP","1314","30951 > 62955 [ACK] Seq=122221 Ack=194 Win=65327 Len=1260"
"160","1.203198000","192.168.2.20","206.116.15.236","TCP","1314","30951 > 62955 [ACK] Seq=123481 Ack=194 Win=65327 Len=1260"
"161","1.211499000","169.254.1.118","255.255.255.255","UDP","724","Source port: 21302  Destination port: 21302"
"162","1.242272000","206.116.15.236","192.168.2.20","TCP","60","62955 > 30951 [ACK] Seq=347 Ack=110881 Win=65392 Len=0"
"163","1.242301000","192.168.2.20","206.116.15.236","TCP","1314","30951 > 62955 [ACK] Seq=124741 Ack=194 Win=65327 Len=1260"
"164","1.242309000","192.168.2.20","206.116.15.236","TCP","1314","30951 > 62955 [ACK] Seq=126001 Ack=194 Win=65327 Len=1260"
"165","1.242312000","192.168.2.20","206.116.15.236","TCP","1314","30951 > 62955 [ACK] Seq=127261 Ack=194 Win=65327 Len=1260"
"166","1.242316000","192.168.2.20","206.116.15.236","TCP","1314","30951 > 62955 [ACK] Seq=128521 Ack=194 Win=65327 Len=1260"
"167","1.247261000","206.116.15.236","192.168.2.20","TCP","60","62955 > 30951 [ACK] Seq=347 Ack=113401 Win=65392 Len=0"
"168","1.247287000","192.168.2.20","206.116.15.236","TCP","1314","30951 > 62955 [ACK] Seq=129781 Ack=194 Win=65327 Len=1260"
"169","1.247292000","192.168.2.20","206.116.15.236","TCP","1314","30951 > 62955 [PSH, ACK] Seq=131041 Ack=194 Win=65327 Len=1260"
"170","1.247297000","192.168.2.20","206.116.15.236","TCP","1314","30951 > 62955 [ACK] Seq=132301 Ack=194 Win=65327 Len=1260"
"171","1.249914000","206.116.15.236","192.168.2.20","TCP","60","62955 > 30951 [ACK] Seq=347 Ack=115921 Win=65392 Len=0"
"172","1.249934000","192.168.2.20","206.116.15.236","TCP","1314","30951 > 62955 [ACK] Seq=133561 Ack=194 Win=65327 Len=1260"
"173","1.249942000","192.168.2.20","206.116.15.236","TCP","1314","30951 > 62955 [ACK] Seq=134821 Ack=194 Win=65327 Len=1260"
"174","1.354827000","206.116.15.236","192.168.2.20","TCP","96","62955 > 30951 [PSH, ACK] Seq=347 Ack=117181 Win=65392 Len=42"
"175","1.354856000","192.168.2.20","206.116.15.236","TCP","82","[TCP Dup ACK 173#1] 30951 > 62955 [ACK] Seq=136081 Ack=194 Win=65327 Len=0 SLE=347 SRE=389 SLE=305 SRE=322 SLE=211 SRE=288"
"176","1.354877000","192.168.2.20","206.116.15.236","TCP","1314","30951 > 62955 [ACK] Seq=136081 Ack=194 Win=65327 Len=1260"
"177","1.356909000","206.116.15.236","192.168.2.20","TCP","60","62955 > 30951 [ACK] Seq=389 Ack=119701 Win=65392 Len=0"
"178","1.356932000","192.168.2.20","206.116.15.236","TCP","1314","30951 > 62955 [ACK] Seq=137341 Ack=194 Win=65327 Len=1260"
"179","1.356938000","192.168.2.20","206.116.15.236","TCP","1314","30951 > 62955 [ACK] Seq=138601 Ack=194 Win=65327 Len=1260"
"180","1.360039000","206.116.15.236","192.168.2.20","TCP","60","62955 > 30951 [ACK] Seq=389 Ack=122221 Win=65392 Len=0"
"181","1.360060000","192.168.2.20","206.116.15.236","TCP","1314","30951 > 62955 [ACK] Seq=139861 Ack=194 Win=65327 Len=1260"
"182","1.360065000","192.168.2.20","206.116.15.236","TCP","1314","30951 > 62955 [ACK] Seq=141121 Ack=194 Win=65327 Len=1260"
"183","1.362323000","206.116.15.236","192.168.2.20","TCP","60","62955 > 30951 [ACK] Seq=389 Ack=124741 Win=65392 Len=0"
"184","1.362347000","192.168.2.20","206.116.15.236","TCP","1314","30951 > 62955 [ACK] Seq=142381 Ack=194 Win=65327 Len=1260"
"185","1.362352000","192.168.2.20","206.116.15.236","TCP","1314","30951 > 62955 [ACK] Seq=143641 Ack=194 Win=65327 Len=1260"
"186","1.384323000","206.116.15.236","192.168.2.20","TCP","60","62955 > 30951 [ACK] Seq=389 Ack=127261 Win=65392 Len=0"
"187","1.384348000","192.168.2.20","206.116.15.236","TCP","1314","30951 > 62955 [ACK] Seq=144901 Ack=194 Win=65327 Len=1260"
"188","1.384353000","192.168.2.20","206.116.15.236","TCP","1314","30951 > 62955 [ACK] Seq=146161 Ack=194 Win=65327 Len=1260"
"189","1.387174000","206.116.15.236","192.168.2.20","TCP","60","62955 > 30951 [ACK] Seq=389 Ack=132301 Win=65392 Len=0"
"190","1.387212000","192.168.2.20","206.116.15.236","TCP","1314","30951 > 62955 [ACK] Seq=147421 Ack=194 Win=65327 Len=1260"
"191","1.387217000","192.168.2.20","206.116.15.236","TCP","1314","30951 > 62955 [ACK] Seq=148681 Ack=194 Win=65327 Len=1260"
"192","1.387221000","192.168.2.20","206.116.15.236","TCP","1314","30951 > 62955 [ACK] Seq=149941 Ack=194 Win=65327 Len=1260"
"193","1.387224000","192.168.2.20","206.116.15.236","TCP","1314","30951 > 62955 [ACK] Seq=151201 Ack=194 Win=65327 Len=1260"
"194","1.392718000","206.116.15.236","192.168.2.20","TCP","60","62955 > 30951 [ACK] Seq=389 Ack=134821 Win=65392 Len=0"
"195","1.392741000","192.168.2.20","206.116.15.236","TCP","1314","30951 > 62955 [ACK] Seq=152461 Ack=194 Win=65327 Len=1260"
"196","1.392746000","192.168.2.20","206.116.15.236","TCP","1314","30951 > 62955 [ACK] Seq=153721 Ack=194 Win=65327 Len=1260"
"197","1.392750000","192.168.2.20","206.116.15.236","TCP","1314","30951 > 62955 [ACK] Seq=154981 Ack=194 Win=65327 Len=1260"
"198","1.507285000","206.116.15.236","192.168.2.20","TCP","60","62955 > 30951 [ACK] Seq=389 Ack=137341 Win=65392 Len=0"
"199","1.507332000","192.168.2.20","206.116.15.236","TCP","1314","30951 > 62955 [ACK] Seq=156241 Ack=194 Win=65327 Len=1260"
"200","1.507343000","192.168.2.20","206.116.15.236","TCP","1314","30951 > 62955 [ACK] Seq=157501 Ack=194 Win=65327 Len=1260"
"201","1.509784000","206.116.15.236","192.168.2.20","TCP","71","62955 > 30951 [PSH, ACK] Seq=389 Ack=138601 Win=65392 Len=17"
"202","1.509805000","192.168.2.20","206.116.15.236","TCP","82","[TCP Dup ACK 200#1] 30951 > 62955 [ACK] Seq=158761 Ack=194 Win=65327 Len=0 SLE=347 SRE=406 SLE=305 SRE=322 SLE=211 SRE=288"
"203","1.509823000","192.168.2.20","206.116.15.236","TCP","1314","30951 > 62955 [ACK] Seq=158761 Ack=194 Win=65327 Len=1260"
"204","1.509850000","206.116.15.236","192.168.2.20","TCP","60","62955 > 30951 [ACK] Seq=406 Ack=141121 Win=65392 Len=0"
"205","1.509860000","192.168.2.20","206.116.15.236","TCP","1314","30951 > 62955 [ACK] Seq=160021 Ack=194 Win=65327 Len=1260"
"206","1.509864000","192.168.2.20","206.116.15.236","TCP","1314","30951 > 62955 [ACK] Seq=161281 Ack=194 Win=65327 Len=1260"
"207","1.514874000","206.116.15.236","192.168.2.20","TCP","60","62955 > 30951 [ACK] Seq=406 Ack=143641 Win=65392 Len=0"
"208","1.514897000","192.168.2.20","206.116.15.236","TCP","1314","30951 > 62955 [ACK] Seq=162541 Ack=194 Win=65327 Len=1260"
"209","1.514903000","192.168.2.20","206.116.15.236","TCP","1314","30951 > 62955 [ACK] Seq=163801 Ack=194 Win=65327 Len=1260"
"210","1.547210000","67.162.114.2","192.168.2.20","UDP","118","Source port: 31543  Destination port: 30951"
"211","1.547308000","192.168.2.20","72.45.131.18","UDP","62","Source port: 30951  Destination port: 46189"
"212","1.547607000","192.168.2.20","76.114.119.164","UDP","118","Source port: 30951  Destination port: 15693"
"213","1.547699000","192.168.2.20","68.15.122.34","UDP","118","Source port: 30951  Destination port: 30079"
"214","1.554799000","206.116.15.236","192.168.2.20","TCP","60","62955 > 30951 [ACK] Seq=406 Ack=148681 Win=65392 Len=0"
"215","1.554846000","192.168.2.20","206.116.15.236","TCP","1314","30951 > 62955 [ACK] Seq=165061 Ack=194 Win=65327 Len=1260"
"216","1.554853000","192.168.2.20","206.116.15.236","TCP","1314","30951 > 62955 [ACK] Seq=166321 Ack=194 Win=65327 Len=1260"
"217","1.554858000","192.168.2.20","206.116.15.236","TCP","1314","30951 > 62955 [ACK] Seq=167581 Ack=194 Win=65327 Len=1260"
"218","1.554862000","192.168.2.20","206.116.15.236","TCP","1314","30951 > 62955 [ACK] Seq=168841 Ack=194 Win=65327 Len=1260"
"219","1.557006000","206.116.15.236","192.168.2.20","TCP","79","62955 > 30951 [PSH, ACK] Seq=406 Ack=149941 Win=65392 Len=25"
"220","1.557027000","192.168.2.20","206.116.15.236","TCP","82","[TCP Dup ACK 218#1] 30951 > 62955 [ACK] Seq=170101 Ack=194 Win=65327 Len=0 SLE=347 SRE=431 SLE=305 SRE=322 SLE=211 SRE=288"
"221","1.557044000","192.168.2.20","206.116.15.236","TCP","1314","30951 > 62955 [ACK] Seq=170101 Ack=194 Win=65327 Len=1260"
"222","1.560048000","206.116.15.236","192.168.2.20","TCP","60","62955 > 30951 [ACK] Seq=431 Ack=152461 Win=65392 Len=0"
"223","1.560068000","192.168.2.20","206.116.15.236","TCP","1314","30951 > 62955 [ACK] Seq=171361 Ack=194 Win=65327 Len=1260"
"224","1.560073000","192.168.2.20","206.116.15.236","TCP","1314","30951 > 62955 [ACK] Seq=172621 Ack=194 Win=65327 Len=1260"
"225","1.560101000","206.116.15.236","192.168.2.20","TCP","60","62955 > 30951 [ACK] Seq=431 Ack=154981 Win=65392 Len=0"
"226","1.560120000","192.168.2.20","206.116.15.236","TCP","1314","30951 > 62955 [ACK] Seq=173881 Ack=194 Win=65327 Len=1260"
"227","1.560123000","192.168.2.20","206.116.15.236","TCP","1314","30951 > 62955 [ACK] Seq=175141 Ack=194 Win=65327 Len=1260"
"228","1.647223000","206.116.15.236","192.168.2.20","TCP","60","62955 > 30951 [ACK] Seq=431 Ack=160021 Win=65392 Len=0"
"229","1.647281000","192.168.2.20","206.116.15.236","TCP","1314","30951 > 62955 [ACK] Seq=176401 Ack=194 Win=65327 Len=1260"
"230","1.647288000","192.168.2.20","206.116.15.236","TCP","1314","30951 > 62955 [ACK] Seq=177661 Ack=194 Win=65327 Len=1260"
"231","1.647291000","192.168.2.20","206.116.15.236","TCP","1314","30951 > 62955 [ACK] Seq=178921 Ack=194 Win=65327 Len=1260"
"232","1.647298000","192.168.2.20","206.116.15.236","TCP","1314","30951 > 62955 [ACK] Seq=180181 Ack=194 Win=65327 Len=1260"
"233","1.647300000","192.168.2.20","206.116.15.236","TCP","1314","30951 > 62955 [ACK] Seq=181441 Ack=194 Win=65327 Len=1260"
"234","1.652790000","206.116.15.236","192.168.2.20","TCP","60","62955 > 30951 [ACK] Seq=431 Ack=162541 Win=65392 Len=0"
"235","1.652811000","192.168.2.20","206.116.15.236","TCP","1314","30951 > 62955 [ACK] Seq=182701 Ack=194 Win=65327 Len=1260"
"236","1.652817000","192.168.2.20","206.116.15.236","TCP","1314","30951 > 62955 [ACK] Seq=183961 Ack=194 Win=65327 Len=1260"
"237","1.659341000","206.116.15.236","192.168.2.20","TCP","60","62955 > 30951 [ACK] Seq=431 Ack=165061 Win=65392 Len=0"
"238","1.659364000","192.168.2.20","206.116.15.236","TCP","1314","30951 > 62955 [ACK] Seq=185221 Ack=194 Win=65327 Len=1260"
"239","1.659370000","192.168.2.20","206.116.15.236","TCP","1314","30951 > 62955 [ACK] Seq=186481 Ack=194 Win=65327 Len=1260"
"240","1.707360000","206.116.15.236","192.168.2.20","TCP","60","62955 > 30951 [ACK] Seq=431 Ack=167581 Win=65392 Len=0"
"241","1.707388000","192.168.2.20","206.116.15.236","TCP","1314","30951 > 62955 [ACK] Seq=187741 Ack=194 Win=65327 Len=1260"
"242","1.707395000","192.168.2.20","206.116.15.236","TCP","1314","30951 > 62955 [ACK] Seq=189001 Ack=194 Win=65327 Len=1260"
"243","1.709812000","206.116.15.236","192.168.2.20","TCP","60","62955 > 30951 [ACK] Seq=431 Ack=170101 Win=65392 Len=0"
"244","1.709832000","192.168.2.20","206.116.15.236","TCP","1314","30951 > 62955 [ACK] Seq=190261 Ack=194 Win=65327 Len=1260"
"245","1.709837000","192.168.2.20","206.116.15.236","TCP","1314","30951 > 62955 [ACK] Seq=191521 Ack=194 Win=65327 Len=1260"
"246","1.709866000","206.116.15.236","192.168.2.20","TCP","60","62955 > 30951 [ACK] Seq=431 Ack=172621 Win=65392 Len=0"
"247","1.709885000","192.168.2.20","206.116.15.236","TCP","1314","30951 > 62955 [ACK] Seq=192781 Ack=194 Win=65327 Len=1260"
"248","1.709888000","192.168.2.20","206.116.15.236","TCP","1314","30951 > 62955 [ACK] Seq=194041 Ack=194 Win=65327 Len=1260"
"249","1.716966000","206.116.15.236","192.168.2.20","TCP","60","62955 > 30951 [ACK] Seq=431 Ack=175141 Win=65392 Len=0"
"250","1.716990000","192.168.2.20","206.116.15.236","TCP","1314","30951 > 62955 [ACK] Seq=195301 Ack=194 Win=65327 Len=1260"
"251","1.716996000","192.168.2.20","206.116.15.236","TCP","1314","30951 > 62955 [ACK] Seq=196561 Ack=194 Win=65327 Len=1260"
"252","1.744511000","91.219.137.255","192.168.2.20","UDP","159","Source port: 37946  Destination port: 49854"
"253","1.744556000","192.168.2.20","91.219.137.255","ICMP","187","Destination unreachable (Port unreachable)"
"254","1.814846000","206.116.15.236","192.168.2.20","TCP","60","62955 > 30951 [ACK] Seq=431 Ack=178921 Win=65392 Len=0"
"255","1.814902000","192.168.2.20","206.116.15.236","TCP","1314","30951 > 62955 [ACK] Seq=197821 Ack=194 Win=65327 Len=1260"
"256","1.814908000","192.168.2.20","206.116.15.236","TCP","1314","30951 > 62955 [PSH, ACK] Seq=199081 Ack=194 Win=65327 Len=1260"
"257","1.814912000","192.168.2.20","206.116.15.236","TCP","1314","30951 > 62955 [ACK] Seq=200341 Ack=194 Win=65327 Len=1260"
"258","1.822198000","206.116.15.236","192.168.2.20","TCP","60","62955 > 30951 [ACK] Seq=431 Ack=181441 Win=65392 Len=0"
"259","1.822220000","192.168.2.20","206.116.15.236","TCP","1314","30951 > 62955 [ACK] Seq=201601 Ack=194 Win=65327 Len=1260"
"260","1.822225000","192.168.2.20","206.116.15.236","TCP","1314","30951 > 62955 [ACK] Seq=202861 Ack=194 Win=65327 Len=1260"
"261","1.822229000","192.168.2.20","206.116.15.236","TCP","1314","30951 > 62955 [ACK] Seq=204121 Ack=194 Win=65327 Len=1260"
"262","1.832652000","206.116.15.236","192.168.2.20","TCP","79","62955 > 30951 [PSH, ACK] Seq=431 Ack=183961 Win=65392 Len=25"
"263","1.832678000","192.168.2.20","206.116.15.236","TCP","82","[TCP Dup ACK 261#1] 30951 > 62955 [ACK] Seq=205381 Ack=194 Win=65327 Len=0 SLE=347 SRE=456 SLE=305 SRE=322 SLE=211 SRE=288"
"264","1.832705000","192.168.2.20","206.116.15.236","TCP","1314","30951 > 62955 [ACK] Seq=205381 Ack=194 Win=65327 Len=1260"
"265","1.832711000","192.168.2.20","206.116.15.236","TCP","1314","30951 > 62955 [ACK] Seq=206641 Ack=194 Win=65327 Len=1260"
"266","1.880098000","206.116.15.236","192.168.2.20","TCP","66","62955 > 30951 [ACK] Seq=456 Ack=185221 Win=65392 Len=0 SLE=187741 SRE=189001"
"267","1.880099000","206.116.15.236","192.168.2.20","TCP","66","[TCP Dup ACK 266#1] 62955 > 30951 [ACK] Seq=456 Ack=185221 Win=65392 Len=0 SLE=187741 SRE=190261"
"268","1.880132000","192.168.2.20","206.116.15.236","TCP","1314","30951 > 62955 [ACK] Seq=207901 Ack=194 Win=65327 Len=1260"
"269","1.884380000","206.116.15.236","192.168.2.20","TCP","66","[TCP Dup ACK 266#2] 62955 > 30951 [ACK] Seq=456 Ack=185221 Win=65392 Len=0 SLE=187741 SRE=191521"
"270","1.884399000","192.168.2.20","206.116.15.236","TCP","1314","30951 > 62955 [ACK] Seq=209161 Ack=194 Win=65327 Len=1260"
"271","1.887197000","206.116.15.236","192.168.2.20","TCP","66","[TCP Dup ACK 266#3] 62955 > 30951 [ACK] Seq=456 Ack=185221 Win=65392 Len=0 SLE=187741 SRE=192781"
"272","1.887216000","192.168.2.20","206.116.15.236","TCP","1314","[TCP Fast Retransmission] 30951 > 62955 [ACK] Seq=185221 Ack=194 Win=65327 Len=1260"
"273","1.887243000","206.116.15.236","192.168.2.20","TCP","66","[TCP Dup ACK 266#4] 62955 > 30951 [ACK] Seq=456 Ack=185221 Win=65392 Len=0 SLE=187741 SRE=194041"
"274","1.887243000","206.116.15.236","192.168.2.20","TCP","66","[TCP Dup ACK 266#5] 62955 > 30951 [ACK] Seq=456 Ack=185221 Win=65392 Len=0 SLE=187741 SRE=196561"
"275","1.887259000","192.168.2.20","206.116.15.236","TCP","844","[TCP Out-Of-Order] 30951 > 62955 [ACK] Seq=186481 Ack=194 Win=65327 Len=790"
"276","1.889959000","206.116.15.236","192.168.2.20","TCP","66","[TCP Dup ACK 266#6] 62955 > 30951 [ACK] Seq=456 Ack=185221 Win=65392 Len=0 SLE=187741 SRE=197821"
"277","1.889975000","192.168.2.20","206.116.15.236","TCP","524","[TCP Retransmission] 30951 > 62955 [ACK] Seq=187271 Ack=194 Win=65327 Len=470"
"278","1.969809000","206.116.15.236","192.168.2.20","TCP","66","[TCP Dup ACK 266#7] 62955 > 30951 [ACK] Seq=456 Ack=185221 Win=65392 Len=0 SLE=187741 SRE=199081"
"279","1.969837000","192.168.2.20","206.116.15.236","TCP","1314","30951 > 62955 [ACK] Seq=210421 Ack=194 Win=65327 Len=1260"
"280","1.972656000","206.116.15.236","192.168.2.20","TCP","66","[TCP Dup ACK 266#8] 62955 > 30951 [ACK] Seq=456 Ack=185221 Win=65392 Len=0 SLE=187741 SRE=200341"
"281","1.972673000","192.168.2.20","206.116.15.236","TCP","1314","30951 > 62955 [ACK] Seq=211681 Ack=194 Win=65327 Len=1260"
"282","1.974792000","206.116.15.236","192.168.2.20","TCP","66","[TCP Dup ACK 266#9] 62955 > 30951 [ACK] Seq=456 Ack=185221 Win=65392 Len=0 SLE=187741 SRE=201601"
"283","1.974809000","192.168.2.20","206.116.15.236","TCP","1314","30951 > 62955 [ACK] Seq=212941 Ack=194 Win=65327 Len=1260"
"284","1.977003000","206.116.15.236","192.168.2.20","TCP","66","[TCP Dup ACK 266#10] 62955 > 30951 [ACK] Seq=456 Ack=185221 Win=65392 Len=0 SLE=187741 SRE=205381"
"285","1.977020000","192.168.2.20","206.116.15.236","TCP","1314","30951 > 62955 [ACK] Seq=214201 Ack=194 Win=65327 Len=1260"
"286","1.989802000","206.116.15.236","192.168.2.20","TCP","66","[TCP Dup ACK 266#11] 62955 > 30951 [ACK] Seq=456 Ack=185221 Win=65392 Len=0 SLE=187741 SRE=206641"
"287","1.989816000","192.168.2.20","206.116.15.236","TCP","1314","30951 > 62955 [ACK] Seq=215461 Ack=194 Win=65327 Len=1260"
"288","1.989836000","206.116.15.236","192.168.2.20","TCP","66","[TCP Dup ACK 266#12] 62955 > 30951 [ACK] Seq=456 Ack=185221 Win=65392 Len=0 SLE=187741 SRE=207901"
"289","1.989845000","192.168.2.20","206.116.15.236","TCP","1314","30951 > 62955 [ACK] Seq=216721 Ack=194 Win=65327 Len=1260"
"290","2.022253000","206.116.15.236","192.168.2.20","TCP","66","[TCP Dup ACK 266#13] 62955 > 30951 [ACK] Seq=456 Ack=185221 Win=65392 Len=0 SLE=187741 SRE=209161"
"291","2.022254000","206.116.15.236","192.168.2.20","TCP","66","[TCP Dup ACK 266#14] 62955 > 30951 [ACK] Seq=456 Ack=185221 Win=65392 Len=0 SLE=187741 SRE=210421"
"292","2.022277000","192.168.2.20","206.116.15.236","TCP","1314","30951 > 62955 [ACK] Seq=217981 Ack=194 Win=65327 Len=1260"
"293","2.022298000","192.168.2.20","206.116.15.236","TCP","1314","30951 > 62955 [ACK] Seq=219241 Ack=194 Win=65327 Len=1260"
"294","2.024529000","206.116.15.236","192.168.2.20","TCP","66","62955 > 30951 [ACK] Seq=456 Ack=186481 Win=65392 Len=0 SLE=187741 SRE=210421"
"295","2.024551000","192.168.2.20","206.116.15.236","TCP","1314","30951 > 62955 [ACK] Seq=220501 Ack=194 Win=65327 Len=1260"
"296","2.027201000","206.116.15.236","192.168.2.20","TCP","66","62955 > 30951 [ACK] Seq=456 Ack=187271 Win=65392 Len=0 SLE=187741 SRE=210421"
"297","2.027219000","192.168.2.20","206.116.15.236","TCP","1314","30951 > 62955 [ACK] Seq=221761 Ack=194 Win=65327 Len=1260"
"298","2.029808000","206.116.15.236","192.168.2.20","TCP","60","62955 > 30951 [ACK] Seq=456 Ack=210421 Win=65392 Len=0"
"299","2.102302000","206.116.15.236","192.168.2.20","TCP","71","62955 > 30951 [PSH, ACK] Seq=456 Ack=211681 Win=65392 Len=17"
"300","2.102303000","206.116.15.236","192.168.2.20","TCP","60","62955 > 30951 [ACK] Seq=473 Ack=214201 Win=65392 Len=0"
"301","2.102340000","192.168.2.20","206.116.15.236","TCP","82","[TCP Dup ACK 297#1] 30951 > 62955 [ACK] Seq=223021 Ack=194 Win=65327 Len=0 SLE=347 SRE=473 SLE=305 SRE=322 SLE=211 SRE=288"
"302","2.102372000","192.168.2.20","206.116.15.236","TCP","1314","30951 > 62955 [ACK] Seq=223021 Ack=194 Win=65327 Len=1260"
"303","2.102375000","192.168.2.20","206.116.15.236","TCP","1314","30951 > 62955 [ACK] Seq=224281 Ack=194 Win=65327 Len=1260"
"304","2.116986000","206.116.15.236","192.168.2.20","TCP","79","62955 > 30951 [PSH, ACK] Seq=473 Ack=216721 Win=65392 Len=25"
"305","2.117009000","192.168.2.20","206.116.15.236","TCP","82","[TCP Dup ACK 303#1] 30951 > 62955 [ACK] Seq=225541 Ack=194 Win=65327 Len=0 SLE=347 SRE=498 SLE=305 SRE=322 SLE=211 SRE=288"
"306","2.117031000","192.168.2.20","206.116.15.236","TCP","1314","30951 > 62955 [ACK] Seq=225541 Ack=194 Win=65327 Len=1260"
"307","2.117036000","192.168.2.20","206.116.15.236","TCP","1314","30951 > 62955 [ACK] Seq=226801 Ack=194 Win=65327 Len=1260"
"308","2.117041000","192.168.2.20","206.116.15.236","TCP","1314","30951 > 62955 [ACK] Seq=228061 Ack=194 Win=65327 Len=1260"
"309","2.152706000","206.116.15.236","192.168.2.20","TCP","60","62955 > 30951 [ACK] Seq=498 Ack=219241 Win=65392 Len=0"
"310","2.152707000","206.116.15.236","192.168.2.20","TCP","60","62955 > 30951 [ACK] Seq=498 Ack=221761 Win=65392 Len=0"
"311","2.152752000","192.168.2.20","206.116.15.236","TCP","1314","30951 > 62955 [ACK] Seq=229321 Ack=194 Win=65327 Len=1260"
"312","2.152759000","192.168.2.20","206.116.15.236","TCP","1314","30951 > 62955 [ACK] Seq=230581 Ack=194 Win=65327 Len=1260"
"313","2.152762000","192.168.2.20","206.116.15.236","TCP","1314","30951 > 62955 [ACK] Seq=231841 Ack=194 Win=65327 Len=1260"
"314","2.152764000","192.168.2.20","206.116.15.236","TCP","1314","30951 > 62955 [ACK] Seq=233101 Ack=194 Win=65327 Len=1260"
"315","2.202235000","98.173.220.140","192.168.2.20","UDP","70","Source port: 42624  Destination port: 30951"
"316","2.202340000","192.168.2.20","98.173.220.140","UDP","62","Source port: 30951  Destination port: 42624"
"317","2.264365000","206.116.15.236","192.168.2.20","TCP","60","62955 > 30951 [ACK] Seq=498 Ack=224281 Win=65392 Len=0"
"318","2.264400000","192.168.2.20","206.116.15.236","TCP","1314","30951 > 62955 [ACK] Seq=234361 Ack=194 Win=65327 Len=1260"
"319","2.264408000","192.168.2.20","206.116.15.236","TCP","1314","30951 > 62955 [ACK] Seq=235621 Ack=194 Win=65327 Len=1260"
"320","2.280118000","206.116.15.236","192.168.2.20","TCP","60","62955 > 30951 [ACK] Seq=498 Ack=229321 Win=65392 Len=0"
"321","2.280147000","192.168.2.20","206.116.15.236","TCP","1314","30951 > 62955 [ACK] Seq=236881 Ack=194 Win=65327 Len=1260"
"322","2.280153000","192.168.2.20","206.116.15.236","TCP","1314","30951 > 62955 [ACK] Seq=238141 Ack=194 Win=65327 Len=1260"
"323","2.280158000","192.168.2.20","206.116.15.236","TCP","1314","30951 > 62955 [ACK] Seq=239401 Ack=194 Win=65327 Len=1260"
"324","2.280161000","192.168.2.20","206.116.15.236","TCP","1314","30951 > 62955 [ACK] Seq=240661 Ack=194 Win=65327 Len=1260"
"325","2.280164000","192.168.2.20","206.116.15.236","TCP","1314","30951 > 62955 [ACK] Seq=241921 Ack=194 Win=65327 Len=1260"
"326","2.304846000","MitacInt_a7:3d:f2","Broadcast","ARP","60","Who has 192.168.2.190?  Tell 192.168.2.5"
"327","2.327224000","206.116.15.236","192.168.2.20","TCP","60","62955 > 30951 [ACK] Seq=498 Ack=234361 Win=65392 Len=0"
"328","2.327253000","192.168.2.20","206.116.15.236","TCP","1314","30951 > 62955 [ACK] Seq=243181 Ack=194 Win=65327 Len=1260"
"329","2.327259000","192.168.2.20","206.116.15.236","TCP","1314","30951 > 62955 [ACK] Seq=244441 Ack=194 Win=65327 Len=1260"
"330","2.327263000","192.168.2.20","206.116.15.236","TCP","1314","30951 > 62955 [ACK] Seq=245701 Ack=194 Win=65327 Len=1260"
"331","2.327266000","192.168.2.20","206.116.15.236","TCP","1314","30951 > 62955 [ACK] Seq=246961 Ack=194 Win=65327 Len=1260"
"332","2.407315000","206.116.15.236","192.168.2.20","TCP","60","62955 > 30951 [ACK] Seq=498 Ack=236881 Win=65392 Len=0"
"333","2.407343000","192.168.2.20","206.116.15.236","TCP","1314","30951 > 62955 [ACK] Seq=248221 Ack=194 Win=65327 Len=1260"
"334","2.407349000","192.168.2.20","206.116.15.236","TCP","1314","30951 > 62955 [ACK] Seq=249481 Ack=194 Win=65327 Len=1260"
"335","2.427240000","206.116.15.236","192.168.2.20","TCP","60","62955 > 30951 [ACK] Seq=498 Ack=239401 Win=65392 Len=0"
"336","2.427270000","192.168.2.20","206.116.15.236","TCP","1314","30951 > 62955 [ACK] Seq=250741 Ack=194 Win=65327 Len=1260"
"337","2.427277000","192.168.2.20","206.116.15.236","TCP","1314","30951 > 62955 [ACK] Seq=252001 Ack=194 Win=65327 Len=1260"
"338","2.432694000","206.116.15.236","192.168.2.20","TCP","60","62955 > 30951 [ACK] Seq=498 Ack=241921 Win=65392 Len=0"
"339","2.432723000","192.168.2.20","206.116.15.236","TCP","1314","30951 > 62955 [ACK] Seq=253261 Ack=194 Win=65327 Len=1260"
"340","2.432729000","192.168.2.20","206.116.15.236","TCP","1314","30951 > 62955 [ACK] Seq=254521 Ack=194 Win=65327 Len=1260"
"341","2.482233000","206.116.15.236","192.168.2.20","TCP","60","62955 > 30951 [ACK] Seq=498 Ack=246961 Win=65392 Len=0"
"342","2.482264000","192.168.2.20","206.116.15.236","TCP","1314","30951 > 62955 [ACK] Seq=255781 Ack=194 Win=65327 Len=1260"
"343","2.482270000","192.168.2.20","206.116.15.236","TCP","1314","30951 > 62955 [ACK] Seq=257041 Ack=194 Win=65327 Len=1260"
"344","2.482275000","192.168.2.20","206.116.15.236","TCP","1314","30951 > 62955 [ACK] Seq=258301 Ack=194 Win=65327 Len=1260"
"345","2.482278000","192.168.2.20","206.116.15.236","TCP","1314","30951 > 62955 [ACK] Seq=259561 Ack=194 Win=65327 Len=1260"
"346","2.482281000","192.168.2.20","206.116.15.236","TCP","1314","30951 > 62955 [ACK] Seq=260821 Ack=194 Win=65327 Len=1260"
"347","2.544477000","206.116.15.236","192.168.2.20","TCP","79","62955 > 30951 [PSH, ACK] Seq=498 Ack=249481 Win=65392 Len=25"
"348","2.544505000","192.168.2.20","206.116.15.236","TCP","82","[TCP Dup ACK 346#1] 30951 > 62955 [ACK] Seq=262081 Ack=194 Win=65327 Len=0 SLE=347 SRE=523 SLE=305 SRE=322 SLE=211 SRE=288"
"349","2.544527000","192.168.2.20","206.116.15.236","TCP","1314","30951 > 62955 [ACK] Seq=262081 Ack=194 Win=65327 Len=1260"
"350","2.544532000","192.168.2.20","206.116.15.236","TCP","1314","30951 > 62955 [ACK] Seq=263341 Ack=194 Win=65327 Len=1260"
"351","2.547994000","192.168.2.20","76.114.119.164","UDP","118","Source port: 30951  Destination port: 15693"
"352","2.548086000","192.168.2.20","68.15.122.34","UDP","118","Source port: 30951  Destination port: 30079"
"353","2.551820000","192.168.2.20","98.173.220.140","UDP","62","Source port: 30951  Destination port: 42624"
"354","2.560094000","206.116.15.236","192.168.2.20","TCP","60","62955 > 30951 [ACK] Seq=523 Ack=252001 Win=65392 Len=0"
"355","2.560120000","192.168.2.20","206.116.15.236","TCP","1314","30951 > 62955 [ACK] Seq=264601 Ack=194 Win=65327 Len=1260"
"356","2.560126000","192.168.2.20","206.116.15.236","TCP","1314","30951 > 62955 [PSH, ACK] Seq=265861 Ack=194 Win=65327 Len=1260"
"357","2.569838000","206.116.15.236","192.168.2.20","TCP","60","62955 > 30951 [ACK] Seq=523 Ack=254521 Win=65392 Len=0"
"358","2.569863000","192.168.2.20","206.116.15.236","TCP","1314","30951 > 62955 [ACK] Seq=267121 Ack=194 Win=65327 Len=1260"
"359","2.569869000","192.168.2.20","206.116.15.236","TCP","1314","30951 > 62955 [ACK] Seq=268381 Ack=194 Win=65327 Len=1260"
"360","2.612690000","206.116.15.236","192.168.2.20","TCP","60","62955 > 30951 [ACK] Seq=523 Ack=257041 Win=65392 Len=0"
"361","2.612716000","192.168.2.20","206.116.15.236","TCP","1314","30951 > 62955 [ACK] Seq=269641 Ack=194 Win=65327 Len=1260"
"362","2.612723000","192.168.2.20","206.116.15.236","TCP","1314","30951 > 62955 [ACK] Seq=270901 Ack=194 Win=65327 Len=1260"
"363","2.614822000","206.116.15.236","192.168.2.20","TCP","60","62955 > 30951 [ACK] Seq=523 Ack=259561 Win=65392 Len=0"
"364","2.614843000","192.168.2.20","206.116.15.236","TCP","1314","30951 > 62955 [ACK] Seq=272161 Ack=194 Win=65327 Len=1260"
"365","2.614852000","192.168.2.20","206.116.15.236","TCP","1314","30951 > 62955 [ACK] Seq=273421 Ack=194 Win=65327 Len=1260"
"366","2.614857000","192.168.2.20","206.116.15.236","TCP","1314","30951 > 62955 [ACK] Seq=274681 Ack=194 Win=65327 Len=1260"
"367","2.617103000","206.116.15.236","192.168.2.20","TCP","60","62955 > 30951 [ACK] Seq=523 Ack=262081 Win=65392 Len=0"
"368","2.617122000","192.168.2.20","206.116.15.236","TCP","1314","30951 > 62955 [ACK] Seq=275941 Ack=194 Win=65327 Len=1260"
"369","2.617127000","192.168.2.20","206.116.15.236","TCP","1314","30951 > 62955 [ACK] Seq=277201 Ack=194 Win=65327 Len=1260"
"370","2.657003000","67.162.114.2","192.168.2.20","UDP","118","Source port: 31543  Destination port: 30951"
"371","2.700267000","206.116.15.236","192.168.2.20","TCP","71","62955 > 30951 [PSH, ACK] Seq=523 Ack=264601 Win=65392 Len=17"
"372","2.700319000","192.168.2.20","206.116.15.236","TCP","82","[TCP Dup ACK 369#1] 30951 > 62955 [ACK] Seq=278461 Ack=194 Win=65327 Len=0 SLE=347 SRE=540 SLE=305 SRE=322 SLE=211 SRE=288"
"373","2.700344000","192.168.2.20","206.116.15.236","TCP","1314","30951 > 62955 [ACK] Seq=278461 Ack=194 Win=65327 Len=1260"
"374","2.700347000","192.168.2.20","206.116.15.236","TCP","1314","30951 > 62955 [ACK] Seq=279721 Ack=194 Win=65327 Len=1260"
"375","2.716710000","Actionte_7e:95:df","Spanning-tree-(for-bridges)_00","STP","60","Conf. Root = 32768/0/00:7f:28:7e:95:e0  Cost = 0  Port = 0x8001"
